{
  "metadata": {
    "part": "TUSS4470",
    "manufacturer": "Texas Instruments",
    "manufacturerConfidence": 1,
    "pdfType": "text_based",
    "pageCount": 49
  },
  "protocol": {
    "bus": "SPI"
  },
  "interface": {
    "kind": "register_map",
    "registers": [
      {
        "name": "BPF_CONFIG_1",
        "address": "0x10",
        "reset": "",
        "width": 8,
        "bitFields": [
          { "name": "BPF_FC_TRIM_FRC", "msb": 7, "lsb": 7 },
          { "name": "BPF_BYPASS", "msb": 6, "lsb": 6 },
          { "name": "BPF_HPF_FREQ", "msb": 5, "lsb": 0 }
        ]
      },
      {
        "name": "BPF_CONFIG_2",
        "address": "0x11",
        "reset": "",
        "width": 8,
        "bitFields": [
          { "name": "BPF_Q_SEL", "msb": 5, "lsb": 4 },
          { "name": "BPF_FC_TRIM", "msb": 3, "lsb": 0 }
        ]
      },
      {
        "name": "DEV_CTRL_1",
        "address": "0x12",
        "reset": "",
        "width": 8,
        "bitFields": [
          { "name": "LOGAMP_FRC", "msb": 7, "lsb": 7 },
          { "name": "LOGAMP_SLOPE_ADJ", "msb": 6, "lsb": 4 },
          { "name": "LOGAMP_INT_ADJ", "msb": 3, "lsb": 0 }
        ]
      },
      {
        "name": "DEV_CTRL_2",
        "address": "0x13",
        "reset": "",
        "width": 8,
        "bitFields": [
          { "name": "LOGAMP_DIS_FIRST", "msb": 7, "lsb": 7 },
          { "name": "LOGAMP_DIS_LAST", "msb": 6, "lsb": 6 },
          { "name": "VOUT_SCALE_SEL", "msb": 2, "lsb": 2 },
          { "name": "LNA_GAIN", "msb": 1, "lsb": 0 }
        ]
      },
      {
        "name": "DEV_CTRL_3",
        "address": "0x14",
        "reset": "",
        "width": 8,
        "bitFields": [
          { "name": "DRV_PLS_FLT_DT", "msb": 4, "lsb": 2 },
          { "name": "IO_MODE", "msb": 1, "lsb": 0 }
        ]
      },
      {
        "name": "VDRV_CTRL",
        "address": "0x16",
        "reset": "",
        "width": 8,
        "bitFields": [
          { "name": "DIS_VDRV_REG_LSTN", "msb": 6, "lsb": 6 },
          { "name": "VDRV_HI_Z", "msb": 5, "lsb": 5 },
          { "name": "VDRV_CURRENT_LEVEL", "msb": 4, "lsb": 4 },
          { "name": "VDRV_VOLTAGE_LEVEL", "msb": 3, "lsb": 0 }
        ]
      },
      {
        "name": "ECHO_INT_CONFIG",
        "address": "0x17",
        "reset": "",
        "width": 8,
        "bitFields": [
          { "name": "ECHO_INT_CMP_EN", "msb": 4, "lsb": 4 },
          { "name": "ECHO_INT_THR_SEL", "msb": 3, "lsb": 0 }
        ]
      },
      {
        "name": "ZC_CONFIG",
        "address": "0x18",
        "reset": "",
        "width": 8,
        "bitFields": [
          { "name": "ZC_CMP_EN", "msb": 7, "lsb": 7 },
          { "name": "ZC_EN_ECHO_INT", "msb": 6, "lsb": 6 },
          { "name": "ZC_CMP_IN_SEL", "msb": 5, "lsb": 5 },
          { "name": "ZC_CMP_STG_SEL", "msb": 4, "lsb": 3 },
          { "name": "ZC_CMP_HYST", "msb": 2, "lsb": 0 }
        ]
      },
      {
        "name": "BURST_PULSE",
        "address": "0x1A",
        "reset": "",
        "width": 8,
        "bitFields": [
          { "name": "HALF_BRG_MODE", "msb": 7, "lsb": 7 },
          { "name": "PRE_DRIVER_MODE", "msb": 6, "lsb": 6 },
          { "name": "BURST_PULSE", "msb": 5, "lsb": 0 }
        ]
      },
      {
        "name": "TOF_CONFIG",
        "address": "0x1B",
        "reset": "",
        "width": 8,
        "bitFields": [
          { "name": "SLEEP_MODE_EN", "msb": 7, "lsb": 7 },
          { "name": "STDBY_MODE_EN", "msb": 6, "lsb": 6 },
          { "name": "VDRV_TRIGGER", "msb": 1, "lsb": 1 },
          { "name": "CMD_TRIGGER", "msb": 0, "lsb": 0 }
        ]
      },
      {
        "name": "DEV_STAT",
        "address": "0x1C",
        "reset": "",
        "width": 8,
        "bitFields": [
          { "name": "VDRV_READY", "msb": 3, "lsb": 3 },
          { "name": "PULSE_NUM_FLT", "msb": 2, "lsb": 2 },
          { "name": "DRV_PULSE_FLT", "msb": 1, "lsb": 1 },
          { "name": "EE_CRC_FLT", "msb": 0, "lsb": 0 }
        ]
      },
      {
        "name": "DEVICE_ID",
        "address": "0x1D",
        "reset": "",
        "width": 8,
        "bitFields": [{ "name": "DEVICE_ID", "msb": 7, "lsb": 0 }]
      },
      {
        "name": "REV_ID",
        "address": "0x1E",
        "reset": "",
        "width": 8,
        "bitFields": [{ "name": "REV_ID", "msb": 7, "lsb": 0 }]
      }
    ]
  },
  "extraction": {
    "status": "complete",
    "detectedPages": [2, 23]
  },
  "validation": {
    "valid": true,
    "errors": [],
    "warnings": []
  }
}
